,ISBN,Book-Title,Book-Author,Year-Of-Publication,Publisher,rating
92584,1570421951,Marshall Loeb's Lifetime Financial Strategies,Marshall Loeb,1996,Time Warner Audio Major,0.0
92585,0787106348,How to Have Confidence and Power in Dealing With People,Leslie T. Giblin,1996,Audio Literature,0.0
92586,1570425035,The Rules(TM) : Time-tested Secrets for Capturing the Heart of Mr. Right,Ellen Fein,1997,Time Warner Audio Major,0.0
92587,0761508147,Visual J++,Charles A. Wood,1996,Prima Publishing,0.0
92588,2277119369,Premier De Cordee,Frison-Roche,0,Editions 84,3.0
92589,2907572121,Les bruines de Lanester,Jean Failler,2003,Du Palemon,2.0
92590,2070360601,Knock,Jules Romains,1972,Schoenhofs Foreign Books,3.4444444444444446
92591,0340618531,Borneo Fire,William Riviere,1996,Sceptre,0.0
92592,1582430047,The Autobiography of Joseph Stalin,Richard Lourie,1999,Perseus Books Group,0.0
92593,0399138641,Leaving Home: A Memoir,Art Buchwald,1994,Putnam Pub Group,3.25
92594,0684811235,WHOS IN CONTROL : Polar Politics and the Sensible Center,Richard Darman,1996,Simon &amp; Schuster,2.3333333333333335
92595,0800792904,Christy,Catherine Marshall,2001,Chosen Books,0.0
92596,0849916046,Seal of Gaia: A Novel of the Antichrist,Marlin Maddoux,1998,W Publishing Group,0.0
92597,0062585495,Packwood: The Public and Private Life from Acclaim to Outrage,Mark Kirchmeier,1995,Harpercollins,0.0
92598,0688119468,Rose's Celebrations,Rose Levy Beranbaum,1992,Harpercollins,4.5
92599,1579542417,Dr. Shapiro's Picture Perfect Weight Loss: The Visual Program for Permanent Weight Loss,Howard M. Shapiro,2000,Rodale Books,5.0
92600,0446513466,No More Cravings,Douglas Hunt,1987,Warner Books,0.0
92601,0062585088,Dianne Feinstein: Never Let Them See You Cry,Jerry Roberts,1994,Harpercollins,0.0
92602,0874779545,Age Power: How the 21st Century Will Be Ruled by the New Old,Ken Dychtwald,1999,Jeremy P. Tarcher,2.5
92603,0684811162,The INHERITANCE : How Three Families and America Moved from Roosevelt to Reagan and Beyond,Samuel G. Freedman,1996,Simon &amp; Schuster,0.0
92604,0684194503,"JUSTICE LEWIS F. POWELL, JR.",John C. Jeffries,1994,Scribner,0.0
92605,0395633184,Strange Justice: The Selling of Clarence Thomas,Jane Mayer,1994,Houghton Mifflin Company,0.0
92606,0310200369,"Mom Factor, The",Henry Cloud,1996,Zondervan Publishing Company,0.0
92607,1561798347,The Best of Times Second Collection (sc),Joe Wheeler,2000,Bethany House Publishers,0.0
92608,0440415403,The Robber and Me,Josef Holub,1999,Yearling,0.0
92609,0151002878,Panther in the Basement,Amos Oz,1997,Harcourt,0.0
92610,0881848050,Thurgood Marshall: Justice for All,Roger Goldman,1992,Pub Group West,0.0
92611,0061010839,Just As I Am: The Autobiography of Billy Graham,Billy Graham,1998,HarperSanFrancisco,0.0
92612,1563056372,Incredible Fishing Stories,Shaun Morey,1994,Workman Publishing,0.0
92613,0446608718,Just Revenge,Alan M. Dershowitz,2000,Warner Books,0.0
92614,0380775395,Rush!,Michael Arkush,1993,Harpercollins,2.0
92615,0523425147,Nypd 2025,Hal Stryker,1985,Pinnacle Books,0.0
92616,0553473654,The Magic Bullet,Harry Stein,1995,Random House Audio,5.0
92617,3442444047,Schwarze TrÃ?Â¼ffel.,Michael Dibdin,2001,Goldmann,5.75
92618,1564311422,Probable Cause,Grif Stockley,2002,Sunset Productions,0.0
92619,0671785060,ELLIE BRADER HATES MR. G : ELLIE BRADER HATES MR. G,Janet Johnson,1995,Aladdin,0.0
92620,0027334635,Fishing,Diana Engel,1993,Simon &amp; Schuster,0.0
92621,0843107405,Baby Pets (Baby Animal Board Book Series),Robin James,1991,Price Stern Sloan,0.0
92622,0440411610,Don't Eat Too Much Turkey!,Miriam Cohen,1996,Doubleday,0.0
92623,0027437906,The Case of the Nervous Newsboy (Mcgurk Mystery),E. W. Hildick,1976,Simon &amp; Schuster,2.5
92624,0786868120,Wigfield : The Can-Do Town That Just May Not,Amy Sedaris,2003,Hyperion,3.4
92625,0783545053,Who Made This Big Mess? (The Big Comfy Couch),Andrew Gutelle,1996,Time-Life Books,3.5
92626,0752815989,Sunburn,Laurence Shames,1998,Orion Publishing Group,0.0
92627,0803291868,My Indian Boyhood,Luther Standing Bear,1988,University of Nebraska Press,0.0
92628,0684850613,Spanking Watson : A Novel (Kinky Friedman Novels (Hardcover)),Kinky Friedman,1999,Simon &amp; Schuster,5.333333333333333
92629,067521162X,Electronic Instrumentation and Measurement,David Buchla,1996,Pearson Education POD,7.0
92630,0806522623,"Hollywood and Whine: The Snippy, Snotty, and Scandalous Things Stars Say About Each Other",Boze Hadleigh,2001,Citadel Press,4.0
92631,0375408746,The News About the News: American Journalism in Peril,LEONARD DOWNIE,2002,Knopf,7.5
92632,0962247502,I'm Okay...but You Have a Lot of Work to Do!,Pam Young,1989,Permanent Pr Washington,0.0
92633,1565123646,The Next Better Place: A Father and Son on the Road,Michael Keith,2002,Algonquin Books of Chapel Hill,9.0
92634,0684870606,Daily Reflections For Highly Effective Teens,Sean Covey,1999,Fireside,5.5
92635,0060174633,Twelve Golden Threads: Lessons for Successful Living from Grandma's Quilt,Aliske Webb,1996,Harpercollins,2.75
92636,8440663218,Fiebre En Las Gradas,Nick Hornby,1996,Ediciones B,8.0
92637,8425333296,Alexandros. El Hijo Del Sueno,Valerio Massimo Manfredi,1999,"Editorial Grijalbo, S.A. de C.V.",2.6666666666666665
92638,8429306382,El Canto del Pajaro,Anthony de Mello,1995,Sal Terrae,7.0
92639,0396070132,Supernatural mysteries and other tales,Edward Rowe Snow,1974,"Dodd, Mead",2.5
92640,0931253004,The Ultimate Pipe Book,Richard Carleton Hacker,1984,Autumngold Pub.,0.0
92641,0395421101,Breaking the Ring,John Barron,1987,Houghton Mifflin,8.5
92642,0684846195,The GOOD BROTHER: A Memoir of Coming Home,Chris Offutt,1998,Simon &amp; Schuster,9.0
92643,0590252712,Scholastic Children's Dictionary,Scholastic Books,1996,Scholastic,5.25
92644,188844424X,Laura's Star,Klaus Baumgart,1997,Futech,9.0
92645,0316236535,"Go Away, Big Green Monster!",Edward R Emberley,1993,"Little, Brown",0.0
92646,0140502068,Madeline and the Bad Hat (Picture Puffin Books (Paperback)),Ludwig Bemelmans,1977,Puffin Books,3.0
92647,0821774891,A Yuletide Treasure (Zebra Regency Romance),Cynthia Pratt,2003,Zebra Books,5.0
92648,0394880560,"Tiger Is a Scaredy Cat (Step into Reading, Step 2)",Joan Phillips,1986,Random House Children's Books,8.0
92649,082177493X,His Lordship's Holiday Surprise (Zebra Regency Romance),Kate Huntington,2003,Zebra Books,6.0
92650,0590127047,Pretend Youre a Cat,Jean Marzollo,0,Scholastic Inc,9.0
92651,0441003044,Dagger Magic: A Novel of the Adept (Adept),Katherine Kurtz,2004,Ace Books,1.8888888888888888
92652,0394800273,"Snow (Beginner Books,)",Roy McKie,1987,Random House Children's Books,8.0
92653,0671449036,OPPOSITES,Sandra Boynton,1982,Little Simon,6.333333333333333
92654,0439112087,"Our Strange New Land: Elizabeth's Diary, Jamestown, Virginia, 1609 (My America (Hardcover))",Patricia Hermes,2000,Scholastic,4.0
92655,0694012874,An Old-Fashioned Girl (C.B. Charmers),Louisa May Alcott,1999,Harpercollins Juvenile Books,2.5
92656,0746023030,The Usborne First Thousand Words (Picture Word Books),Heather Amery,1996,Usborne Books,9.0
92657,1564582035,A Child's Book of Art: Great Pictures First Words,Lucy Micklethwait,1993,DK Publishing Inc,9.0
92658,0792272218,National Geographic Student Atlas Of The World,National Geographic Society,2001,National Geographic,9.0
92659,0064441091,No More Monsters for Me! (I Can Read Book 1),Peggy Parish,1987,HarperTrophy,6.0
92660,0064440206,Frog and Toad Are Friends (I Can Read Book 2),Arnold Lobel,1979,HarperTrophy,3.8333333333333335
92661,0064440524,Wagon Wheels (I Can Read Books),Barbara Brenner,1993,HarperCollins Publishers,2.5
92662,0064440311,Daniel's Duck (I Can Read Book 3),Clyde Robert Bulla,1982,HarperTrophy,0.0
92663,0064440087,Harry and the Lady Next Door (I Can Read Book 1),Gene Zion,1978,HarperTrophy,0.0
92664,0064440400,Hill of Fire (I Can Read Book 3),Thomas P. Lewis,1983,HarperTrophy,0.0
92665,0802137814,Love Life: A Novel,Tseruyah Shalev,2001,Grove Press,3.5
92666,006444144X,Greg's Microscope (I Can Read Book 3),Millicent E. Selsam,1990,HarperTrophy,2.3333333333333335
92667,0064440346,Owl at Home (I Can Read Book 2),Arnold Lobel,1982,HarperTrophy,2.5
92668,0374404321,The Apprentice,Pilar Molina Lorente,1994,"Farrar, Straus and Giroux (BYR)",0.0
92669,0152234152,Detectives in Togas (Odyssey Classic),Henry Winterfeld,1990,Harcourt,0.0
92670,8433910892,Cuatro Amigos (Narrativas Hispanicas),David Trueba,2000,Anagrama,6.0
92671,0064440133,Mouse Tales (I Can Read Book 2),Arnold Lobel,1978,HarperTrophy,1.25
92672,0440463025,Nate the Great Goes Undercover,Marjorie Weinman Sharmat,1978,Yearling Books,1.25
92673,0064421325,The Sword in the Tree (Trophy Chapter Book),Clyde Robert Bulla,2000,HarperTrophy,0.0
92674,0140345434,The Singing Tree (Puffin Newbery Library),Kate Seredy,1990,Puffin Books,0.0
92675,0064401154,Shadrach (Harper Trophy Books (Paperback)),Meindert DeJong,1980,HarperTrophy,0.0
92676,0440400392,"Nate The Great And The Fishy Prize (Nate The Great, paper)",Marjorie Weinman Sharmat,1988,Yearling Books,0.0
92677,0590414313,The Magic School Bus on the Ocean Floor (Magic School Bus (Paperback)),Joanna Cole,1994,Unknown,1.5384615384615385
92678,0590403605,The Magic School Bus: At the Waterworks (Magic School Bus (Paperback)),Joanna Cole,1988,Scholastic,4.230769230769231
92679,0590479776,The Aesop for Children,Mio Winter,1994,Scholastic,8.0
92680,0860209598,The Usborne Book of World History (Guided Discovery Program),Jenny Tyler,1985,E.D.C. Publishing,10.0
92681,0771099983,The Double Hook (New Canadian Library),Sheila Watson,1989,New Canadian Library,2.3333333333333335
92682,0141301295,The House on Walenska Street (Puffin Chapters),Charlotte Herman,1998,Puffin Books,3.0
92683,0064441059,Surprises (I Can Read Book 3),Lee Bennett Hopkins,1986,HarperTrophy,4.666666666666667
92684,1570624240,Writing Down the Bones: Freeing the Writer Within (Pocket Classics),Natalie Goldberg,1998,Shambhala,5.0
92685,1864502029,Lonely Planet New Caledonia (Lonely Planet New Caledonia),Leanne Logan,2001,Lonely Planet Publications,8.0
92686,0553378392,Walking to Mercury,Starhawk,1998,Bantam,2.625
92687,0060929987,Family Pictures : A Novel,Sue Miller,1999,Perennial,2.0
92688,0140245251,Like People in History,Felice Picano,1996,Penguin Books,4.5
92689,0679454691,Women With Men: Three Stories,Richard Ford,1997,Random House Inc,0.0
92690,0679774203,Mrs Pollifax Innocent Tourist: A Novel (Random House Large Print),Dorothy Gilman,1997,Random House Large Print Publishing,4.0
92691,0811832937,Baby's Room: Ideas and Projects for Nurseries,Jessica Strand,2002,Chronicle Books,6.0
92692,0821741837,Saint Peter's Wolf,Michael Cadnum,1993,Zebra Books,0.0
92693,0385324022,Marriage Shock: The Transformation of Women into Wives,Dalma Heyn,1998,Bantam Dell Pub Group,2.0
92694,0767900421,How One of You Can Bring the Two of You Together,Sue Ellen Page,1998,Broadway Books,1.6666666666666667
92695,0380789795,Miracle on the Mountain : A True Tale of Faith and Survival,Mike &amp; Mary Couillard,1999,Avon,9.0
92696,1414008376,B29 Navigator Korean War 1951,Ralph Livengood,2003,1stBooks Library,0.0
92697,0231101570,World Orders Old and New,Noam Chomsky,1996,Columbia University Press,3.5
92698,3442453283,Der kleine LiebestÃ?Â¶ter. Wie du deinen Lover garantiert in die Flucht schlÃ?Â¤gst.,Michele Alexander,2002,Goldmann,6.25
92699,3442449804,Die Wege des BÃ?Â¶sen. Stories.,Ruth Rendell,2001,Goldmann,4.0
92700,3442541549,TÃ?Â¶dliche Versuchung.,Janet Evanovich,2001,Goldmann,0.0
92701,0523424701,V: The Texas Run (V Series),George Proctor,1985,Pinnacle Books,1.6666666666666667
92702,0394730380,The Zen of Running,Fred Rohe,1975,Random House Inc,7.6
92703,0864422229,Lonely Planet Islands of Australia's Great Barrier Reef (Lonely Planet Islands of Australia's Great Barrier Reef),Tony Wheeler,1994,Lonely Planet,9.0
92704,0340801549,Native American Myths (Teach Yourself),Steve Eddy,2001,Hodder Arnold Teach Yourself,0.0
92705,0141004606,Eli's Wings,Elizabeth Best,2003,Penguin Books,10.0
92706,0517704005,A Home for the Soul: A Guide for Dwelling With Spirit and Imagination,Anthony Lawlor,1997,Crown Publishing Group (NY),0.0
92707,0312173555,A Few Thousand Words About Love: Mickey Pearlman,Mickey Pearlman,1998,St. Martin's Press,4.0
92708,0393320820,State of the World 2001 (Worldwatch Institute Books),Lester R. Brown,2001,W.W. Norton &amp; Company,5.0
92709,1881394204,Call to Connection : Bringing Sacred Tribal Values into Modern Life,Carole Kammen,1998,Commune-a-Key Pub.,4.0
92710,0882681974,The Wild Mother,Elizabeth Cunningham,1995,Station Hill Press,0.0
92711,0374266956,The Sounds of Poetry : A Brief Guide,Robert Pinsky,1998,"Farrar, Straus and Giroux",3.3333333333333335
92712,067976657X,Krik? Krak! (Vintage Contemporaries),Edwidge Danticat,1996,Vintage Books USA,3.6470588235294117
92713,3453097742,Nackte Angst.,Dean Koontz,1996,Heyne,0.0
92714,3423129727,Bauchlandung. Geschichten zum Anfassen.,Julia Franck,2002,Dtv,0.0
92715,0062507311,On Women Turning Fifty : Celebrating Mid-Life Discoveries,Cathleen Rountree,1994,HarperSanFrancisco,2.8333333333333335
92716,3492220185,Das Geheimnis der Pineta.,Carlo Fruttero,2000,Piper,3.6666666666666665
92717,3492219152,Die Wahrheit Ã?Â¼ber den Fall D.,Carlo Fruttero,1999,Piper,5.0
92718,3442427401,Mut und Gnade.,Ken Wilber,1996,Goldmann,4.5
92719,034543529X,Dragon's Egg (Del Rey Impact),ROBERT L. FORWARD,2000,Del Rey,5.833333333333333
92720,340414404X,"Wie man eine Zigarre raucht, ohne sich die Finger zu verbrennen.",Jane Green,2000,LÃ?Â¼bbe,0.5
92721,3442428785,Zweimal ist einmal zuviel.,Janet Evanovich,1999,Goldmann,5.0
92722,1577780728,"Jesus Freaks: DC Talk and The Voice of the Martyrs - Stories of Those Who Stood For Jesus, the Ultimate Jesus Freaks",DC Talk,1999,Bethany House Publishers,7.533333333333333
92723,0515104329,"Peace, Beetle Bailey",Mort Walker,1992,Jove Books,8.0
92724,0205349773,Social Psychology (10th Edition),Robert A. Baron,2002,Allyn &amp; Bacon,8.0
92725,0130481769,Abnormal Psychology in a Changing World with CD-ROM (5th Edition),Jeffrey S. Nevid,2002,Prentice Hall,9.0
92726,0205323669,"Drugs, Behavior, and Modern Society (3rd Edition)",Charles F. Levinthal,2001,Allyn &amp; Bacon,8.0
92727,0448089580,The Sting of the Scorpion (Hardy Boys Mystery Stories ; 58),Franklin W. Dixon,1979,Grosset &amp; Dunlap,1.6666666666666667
92728,3442541670,Flug 2039.,Chuck Palahniuk,2003,Goldmann,2.1666666666666665
92729,3442356903,Hochzeit in Las Vegas.,Belinda Jones,2002,Goldmann,0.0
92730,0448089424,Viking Symbol Mystery (Hardy Boys Mystery Stories),Franklin W. Dixon,1963,Grosset &amp; Dunlap,1.6666666666666667
92731,0448089416,Clue of the Screeching Owl: #41 (Hardy Boys),Franklin W. Dixon,1962,Grosset &amp; Dunlap,1.6
92732,0448089394,Mystery of the Chinese Junk (Hardy Boys Mystery Stories),Franklin W. Dixon,1959,Grosset &amp; Dunlap,7.5
92733,0448089386,"Mystery at Devil's Paw, (Hardy Boys Mystery Stories)",Franklin W. Dixon,1959,Grosset &amp; Dunlap,0.0
92734,0448089335,"The Yellow Feather Mystery, (Hardy Boys Mystery Stories)",Franklin W. Dixon,1975,Grosset &amp; Dunlap,0.0
92735,0448089289,The Sign of the Crooked Arrow (Hardy Boys (Hardcover)),Franklin W. Dixon,1970,Grosset &amp; Dunlap,0.0
92736,0448089246,Short-Wave Mystery (Hardy Boys Mystery Stories),Franklin W. Dixon,1966,Grosset &amp; Dunlap,0.0
92737,0448089203,"Mystery of the Flying Express, (Hardy Boys Mystery Stories)",Franklin W. Dixon,1941,Grosset &amp; Dunlap,7.5
92738,0448089122,Footprints Under the Window (Hardy Boys Mystery Stories),Franklin W. Dixon,1933,Grosset &amp; Dunlap,0.0
92739,0448089114,While the Clock Ticked (Hardy Boys Mystery Stories),Franklin W. Dixon,1932,Grosset &amp; Dunlap,0.0
92740,0448089106,"What Happened at Midnight (The Hardy Boys Mystery, Book 10)",Franklin W. Dixon,1967,Grosset &amp; Dunlap,3.75
92741,0534365825,Brain and Behavior (with InfoTrac and CD-ROM),Bob L. Garrett,2003,Wadsworth Publishing,7.0
92742,3499421909,Blut Ist Dunkler Als Rote Tinte,Martin,0,Rowohlt Taschenbuch Verlag GmbH,0.0
92743,0072411406,The Basics: A Rhetoric and Handbook,Santi V. Buscemi,1999,McGraw-Hill College,5.0
92744,0767421523,Research Design and Methods: A Process Approach,Kenneth S. Bordens,2001,McGraw-Hill Humanities/Social Sciences/Languages,0.0
92745,0534586171,Essentials of Statistics for the Behavioral Sciences,Frederick Gravetter,2001,Wadsworth Publishing,4.0
92746,053458618X,"Essentials of Statistics for the Behavioral Sciences: Study Guide, Fourth Edition",Frederick J. Gravetter,2002,Thomson Learning,0.0
92747,0534608671,Cognition : Theory and Applications (with Study Guide and InfoTrac),Stephen K. Reed,2003,Wadsworth Publishing,6.0
92748,0205353908,Human Communication: The Basic Course (9th Edition),Joseph A. DeVito,2002,Allyn &amp; Bacon,8.0
92749,0130209899,Theories of Personality: Understanding Persons (3rd Edition),Susan C. Cloninger,1999,Pearson Education,1.0
92750,0130918369,Anthropology (10th Edition),Carol R. Ember,2001,Prentice Hall PTR,0.0
92751,0205360041,An Introduction to Human Services: Policy and Practice (5th Edition),Betty Reid Mandell,2002,Pearson Allyn &amp; Bacon,6.0
92752,0130884138,Choice and Change: The Psychology of Personal Growth and Interpersonal Relationships (6th Edition),April O'Connell,2000,Prentice Hall,9.0
92753,0155062050,E-Fictions,Joseph F. Trimmer,2001,Heinle,6.0
92754,0130282545,Religions of the World (8th Edition),Lewis M. Hopfe,2000,Pearson Education,5.0
92755,078795019X,The Dynamics of Conflict Resolution: A Practitioner's Guide,Bernard  Mayer,2000,Jossey-Bass,3.0
92756,0448095521,"The Secret of the Forgotten City (Nancy Drew Mystery Stories, No 52)",Carolyn Keene,1975,Grosset &amp; Dunlap,2.142857142857143
92757,0448095475,"The Mysterious Mannequin (Nancy Drew Mystery Stories, No 47)",Carolyn Keene,1970,Grosset &amp; Dunlap,0.0
92758,0448095483,"The Crooked Banister (Nancy Drew Mystery Stories, No 48)",Carolyn Keene,1971,Grosset &amp; Dunlap,0.0
92759,0448095378,"The Clue in the Old Stagecoach (Nancy Drew Mystery Stories, No 37)",Carolyn Keene,1960,Grosset &amp; Dunlap,3.0
92760,0448095092,"The Sign of the Twisted Candles (Nancy Drew Mystery Stories, No 9)",Carolyn Keene,1968,Grosset &amp; Dunlap,2.0
92761,0439358078,Harry Potter and the Order of the Phoenix (Book 5),J. K. Rowling,2004,Scholastic Paperbacks,2.727272727272727
92762,0671724002,The Quick and Easy Way to Effective Speaking,Dale Carnegie,1990,Pocket,0.0
92763,0873585852,Walking the Twilight: Women Writers of the Southwest,Kathryn Wilder,1994,Northland Pub,0.0
92764,0671708260,How To Enjoy Your Life And Your Job,Dale Carnegie,1990,Pocket,3.6
92765,1585420700,The Ultimate Personality Guide,Jennifer Freed,2001,Jeremy P. Tarcher,6.0
92766,0460874675,Emma (Everyman's Library (Paper)),Jane Austen,1995,Tuttle Pub,2.0
92767,0140139397,The Big Rock Candy Mountain (Contemporary American Fiction),Wallace Stegner,1995,Penguin Books,5.5
92768,0373166265,"Daddy On Demand (Harlequin American Romance, No 626)",Judy Christenberry,1996,Harlequin,3.1666666666666665
92769,0060913185,Soong Dynasty,Sterling Seagrave,1986,Perennial,3.3333333333333335
92770,0806987898,Brain Bafflers,Robert Steinwachs,1993,Sterling Pub Co Inc,6.0
92771,0435126105,New Windmill Classics: Sherlock Holmes Short Stories (New Windmills),Arthur Conan Doyle,1995,Heinemann Educational Books - Secondary Division,10.0
92772,0060518057,Dilbert and the Way of the Weasel,Scott Adams,2002,HarperBusiness,5.0
92773,0435123904,New Windmills: The Secret Diary of Adrian Mole Aged 13 3/4 (New Windmills),Sue Townsend,1992,Heinemann Educational Books - Secondary Division,6.0
92774,0140347968,Puzzling People (Puffin Books),Scoular Anderson,1992,Puffin Books,8.0
92775,0192861832,The Diary of the Other Health Freak,Ann McPherson,1996,Oxford University Press,5.666666666666667
92776,0192861824,The New Diary of a Teenage Health Freak,Aidan MacFarlane,1996,Oxford Univ Pr,9.0
92777,0140260307,Raise the Red Lantern: Three Novellas,Su Tong,1996,Penguin Books,5.2
92778,0831795042,Treasury of Charles Dickens,Charles Dickens,1989,Smithmark Publishers,0.0
92779,0312028660,The Beloved Prison: Journey into the Unknown Self,Lucy Freeman,1989,St Martins Pr,0.0
92780,0805013695,The Green Lifestyle Handbook: 1001 Ways to Heal the Earth,Jeremy Rifkin,1990,Henry Holt &amp; Co,7.0
92781,0553269860,No Down Payment Formulas: Over 100 Ways to Buy Real Estate for Little or Nothing Down,Ed Beckley,1987,Bantam Books,0.0
92782,0964852683,Survival Jobs: 118 Ways to Make Money While Pursuing Your Dreams,Deborah Jacobson,1996,Windtree Pub,7.0
92783,0452267781,Dates from Hell: True Stories from the Front,Katherine Ann Samon,1992,Penguin USA,3.7142857142857144
92784,0446391190,Getting Organized,Stephanie Winston,1989,Warner Books> C/o Little Br,6.0
92785,0671888269,PLAYING THE PERSONALS: DATING IN THE NINETIES : PLAYING THE PERSONALS: DATING IN THE NINETIES,Morris L. Cohen,1996,Pocket,0.0
92786,0761504451,The Twenty-Something Guide to Creative Self-Employment: Making Money While Keeping Your Freedom,Jeff Porten,1996,Prima Lifestyles,5.0
92787,0060954930,Secrets of a Fashion Therapist: What You Can Learn Behind the Dressing Room Door,Betty Halbreich,2000,HarperResource,0.0
92788,0517119285,"Three Complete Novels: Lights, Laughter and a Lady/Love in the Moon/Bride to the King",Barbara Cartland,1994,Wings,5.0
92789,038065573X,Recalled by Life,Anthony Sattilaro,1984,Harper Mass Market Paperbacks,8.0
92790,0676974317,Spelling Mississippi,MARNIE WOODROW,2002,Knopf Canada,1.8
92791,0553373943,The Gates of Twilight (Bantam Spectra Book),Paula Volsky,1996,Bantam,2.3333333333333335
92792,1551666863,His Touch,Mary Lynn Baxter,2003,Mira Books,2.8333333333333335
92793,0553378465,The White Tribunal (Bantam Spectra Book),Paula Volsky,1997,Bantam,7.0
92794,0393316734,Commodify Your Dissent: Salvos from the Baffler,Thomas Frank,1997,W. W. Norton &amp; Company,0.0
92795,0671630148,Strange and Amazing Facts About Star Trek,Daniel Cohen,1986,Pocket Books,2.0
92796,0380818302,"Daughter of Troy: A Magnificent Saga of Courage, Betrayal, Devotion, and Destiny",Sarah B. Franklin,2002,HarperTorch,2.25
92797,0812524004,Ultimatum,R.J. Pineiro,1995,Tor Books (Mm),1.5
92798,006109739X,Except the Dying,Maureen Jennings,1999,HarperCollins Publishers,0.0
92799,0380806479,Time and Time Again,Dennis Danvers,2001,Eos,4.333333333333333
92800,0345459407,Perdido Street Station,China Mieville,2003,Del Rey Books,2.8333333333333335
92801,0553581724,Buried Bones,CAROLYN HAINES,2000,Bantam,2.4444444444444446
92802,1551924765,Mars Eclipsed: A Katy Klein Mystery (Katy Klein Mysteries),Karen Irving,2002,Raincoast Books,4.0
92803,0441010776,Knight Life,Peter David,2003,Ace Books,3.5
92804,0451456688,Silk,Caitlin R. Kiernan,2002,Roc,3.3125
92805,0688146910,Emeril's Creole Christmas,Emeril Lagasse,1997,Morrow Cookbooks,2.3333333333333335
92806,0953596400,Philos,J.G. Messervy-Norman,1999,Biscuit Tree Books,10.0
92807,0553579134,First Evidence,Kenneth W. Goddard,2000,Bantam Books,2.9
92808,0898797624,Science Fiction and Fantasy Writer's Sourcebook: Where to Sell Your Manuscripts (2nd ed),David H. Borcherding,1996,Writer's Digest Books,6.0
92809,082173573X,Millionaire's Hill,Peggy Petkus,1991,Zebra Books,0.0
92810,0671028057,"Up, Up, and Away",Nancy Holder,1999,Simon Spotlight Entertainment,5.666666666666667
92811,0671004611,The DAY AFTER ROSWELL,Philip Corso,1997,Atria,4.0
92812,0878573402,Square Foot Gardening: A New Way to Garden in Less Space With Less Work,Mel Bartholomew,1981,St Martins Pr,8.0
92813,0679756477,"Love, Alice: My Life As a Honeymooner",Audrey Meadows,1994,Ballantine Books,8.5
92814,0312962657,Emergency!: True Stories from the Nation's Ers (Emergency!),Marc Tolon Brown,1997,St. Martin's Press,6.8
92815,0385083742,Toulouse-Lautrec (The Great impressionists),Philippe Huisman,1973,Doubleday,9.0
92816,0471018732,"Professional Photoshop: Color Correction, Retouching, and Image Manipulation With Adobe Photoshop",Dan Margulis,1994,John Wiley &amp; Sons Inc,9.0
92817,0385233728,Healing Into Life and Death,Stephen Levine,1987,Anchor Books/Doubleday,0.0
92818,0764502050,HTML 4 (Dummies 101 Series),Deborah S. Ray,1998,For Dummies,9.0
92819,0891347550,Fresh Ideas in Brochure Design (Fresh Ideas),Terri Alekzander,1997,F &amp; W Pubns,7.0
92820,1888869003,Mind Grenades: Manifestos from the Future,John Plunkett,1996,Hardwired,8.0
92821,0394516427,Fat Woman,Leon Rooke,1981,Random House Inc,0.0
92822,0886777232,Future Net,Martin H. Greenberg,1996,Daw Books,7.0
92823,0941423522,"In the Realms of the Unreal: \Insane\"" Writings""",John G. H. Oakes,1991,Four Walls Eight Windows,0.0
92824,055327872X,Housekeeping,Marilynne Robinson,1988,Bantam Books,3.4444444444444446
92825,0670885177,Reap,Eric Rickstad,2000,Viking Books,0.0
92826,0895776294,The master of Ballantrae: A winter's tale (The World's best reading),Robert Louis Stevenson,1995,Reader's Digest Association,4.0
92827,0706405528,Cowboys and Indians: An Illustrated History,Royal B. Hassrick,1981,Smithmark Pub,0.0
92828,0848706811,All Through the House: Christmas in Cross-Stitch from the Vanessa-Ann Collection,Vanessa-Ann Collection,1985,Leisure Arts,0.0
92829,0688069924,Sally: Unconventional Success,Sally Jesse Raphael,1990,Harpercollins,2.3333333333333335
92830,0140267697,Storyville,Lois Battle,1997,Penguin Books,2.090909090909091
92831,0848707109,Christmas Is Coming! 1987,Linda Martin Stewart,1987,Little Brown &amp; Co,0.0
92832,1565123360,The Curve of the World: A Novel,Marcus Stevens,2002,Algonquin Books of Chapel Hill,1.6666666666666667
92833,0671690027,Theirs Is the Kingdom: The Wealth of the British Royal Family,Andrew Morton,1989,Simon &amp; Schuster,0.0
92834,0399127267,June Allyson,June Allyson,1982,Putnam Publishing Group,0.0
92835,0399132619,The Timothy Files,Lawrence Sanders,1987,Putnam Pub Group,7.0
92836,0312014694,Liberace: The True Story,Bob Thomas,1988,St Martins Pr,6.0
92837,0385176449,Cashmere,Nicola Thorne,1982,Doubleday Books,6.0
