,ISBN,Book-Title,Book-Author,Year-Of-Publication,Publisher,rating
94966,0788754882,The Cat Who Saw Red (Cat Who... (Audio)),Lilian Jackson Braun,2001,Recorded Books Unabridged,7.0
94967,067170608X,And Then There Were None,Agatha Christie,1991,Pocket Books,2.25
94968,0140367225,Robinson Crusoe (Puffin Classics),Daniel Defoe,1995,Puffin Books,0.0
94969,0786914246,White Plume Mountain (Greyhawk),Paul Kidd,1999,Wizards of the Coast,3.3333333333333335
94970,0380790734,"The Shadow Eater (Dominions of Irth/Adam Lee, Bk 2)",Adam Lee,1998,Harpercollins,0.0
94971,0812577590,The Sky Road,Ken MacLeod,2001,Tor Books,0.0
94972,0671734830,WAY OF THE SAMURAI (MUSASHI 1) (Musashi Book 1),Eiji Yoshikawa,1990,Pocket,0.0
94973,0441006957,The Price of Peace,Mike Moscoe,2000,Ace Books,0.0
94974,0451206916,Savage Cry,Charles G. West,2002,Signet Book,0.0
94975,0446521590,The Visionary,Donald S. Passman,1999,Warner Books Inc,2.8333333333333335
94976,0553572504,Death and the Language of Happiness,John Straley,1998,Bantam Doubleday Dell Publishing Group,1.5
94977,0425169278,Taken At The Flood (A Hercule Poirot Mystery),Agatha Christie,1998,Berkley Publishing Group,0.0
94978,0451197674,Code Blue,Nancy Fisher,2000,Onyx Books,1.1666666666666667
94979,0312254954,Delirium of the Brave,William Charles Harris,1999,St. Martin's Press,3.1666666666666665
94980,0312971532,The Red Ripper,Kerry Newcomb,2000,St. Martin's Press,0.0
94981,0380716968,And Then You Die: A Gil Disbro Mystery,James E. Martin,1993,Harper Mass Market Paperbacks,0.0
94982,0441007953,They Also Serve,Mike Moscoe,2001,Ace Books,0.0
94983,0812571916,Outward Bound: A Jupiter Novel,James P. Hogan,2000,Tor Books,0.0
94984,0312962584,Seeing Fireworks (Seeing Fireworks),Elaine Coffman,1997,St. Martin's Press,0.0
94985,1583141448,True Love (Arabesque),Brenda Jackson,2000,Arabesque,0.0
94986,0140096930,The Book of Laughter and Forgetting,Milan Kundera,1989,Penguin USA,2.8125
94987,0671491660,HICKRY DICKRY DETH,Agatha Christie,1983,Pocket,0.0
94988,0440322278,18 Best Stories by Edgar Allan Poe,Edgar Allan Poe,1983,Dell Publishing Company,6.333333333333333
94989,0312931034,Serpent's Silver,Piers Anthony,1988,St Martins Pr,3.0
94990,0804106118,Gone to Earth,Rick Boyer,1991,Fawcett Books,0.0
94991,0451143876,To Absent Friends from Red Smith,Red Smith,1986,New Amer Library (Mm),0.0
94992,0553138995,The Mediterranean Caper,Clive Cussler,1980,Bantam Books,0.0
94993,0671014447,The FIRST LADY MURDERS,Nancy Pickard,1999,Pocket Books,0.8571428571428571
94994,0882075926,Stand Tough,Powell,1983,Scripture Pr Pubns,0.0
94995,0425054659,Third Deadly Sin,Lawrence Sanders,1982,Berkley Publishing Group,1.4285714285714286
94996,1556114656,The Cousins: A Novel,Rona Jaffe,1995,Penguin USA,0.0
94997,0743406923,The Purple Fingerprint,Carolyn Keene,2001,Aladdin,0.0
94998,1929766122,5 Green and Speckled Frogs,Martin Kelly,2000,Handprint Books,0.0
94999,0743413016,The Dream Master (The Nebula Award-Winning Novel),Roger Zelazny,2001,I Books,4.0
95000,0373441525,If the Shoe Fits / Designs on Jake (Harlequin Duets 2-In-1 No 86),Samantha Connolly,2002,Harlequin,3.3333333333333335
95001,0441005225,Clones (Ace Science Fiction),Jack Dann,1998,Ace Books,3.0
95002,0345284941,SS/GB,Deighton,1979,Not Avail,0.0
95003,0345330064,"Seeress of Kell (Malloreon, Book 5)",David Eddings,1991,Ballantine Books,0.0
95004,0812881842,The Golden Express,Derek Lambert,1985,Natl Book Network,0.0
95005,1575663686,Sounding Drum,Larry Jay Martin,1999,Kensington Pub Corp,0.0
95006,1932270124,The Richest Girl in the World: Athina Onassis Roussel : The Onassis Family Legacy,Thomas Martin,2003,AMI Books,0.0
95007,1570422990,Strange Highways: The Chase,Dean R. Koontz,1995,Time Warner AudioBooks,7.0
95008,0553473077,Cold Cold Heart,James Elliot,1994,Random House Audio,5.0
95009,0743523326,He Sees You While You're Sleeping,Mary Higgins Clark,2001,Audioworks,7.0
95010,0446531103,Dumping Billy,Olivia Goldsmith,2004,Warner Books,1.75
95011,155882037X,"Kinds of Love, Kinds of Death",Donald E. Westlake,2001,International Polygonics,0.0
95012,0821728164,The Junkyard,Barry Porter,1989,Zebra Books,0.0
95013,1843094444,A Handbook of Fighter Aircrafts,Francis Crosby,2002,Hermes House,8.0
95014,0804108811,Morgan's Passing,Anne Tyler,1992,Ivy Books,2.3333333333333335
95015,0848706323,Cooking for company,Winifred Green Cheney,1985,Oxmoor House,0.0
95016,0688088058,The Hole in the Flag: A Romanian Exile's Story of Return and Revolution,Andrei Codrescu,1991,Harpercollins,6.0
95017,0671878522,The NEW HUGO WINNERS IV (Vol 4),Gregory Benford,1997,Baen,3.5
95018,0812543432,Pestis 18,Sharon Webb,1996,Tor Books,4.0
95019,0451450833,"The Darkest Day (Iron Tower Trilogy, Book 3)",Dennis L. McKiernan,1994,Roc,6.0
95020,0380718766,Buddy Holly Is Alive and Well on Ganymede,Bradley Denton,1992,Harper Mass Market Paperbacks,2.25
95021,0312865163,"The Truthsayer's Apprentice (The Loregiver Series, Book 1)",Deborah Christian,1999,Tor Books,2.5
95022,0399132244,The Ascension Factor,Bill Ransom,1988,Putnam Pub Group,0.0
95023,8470394363,"Colmena, La (Clasicos Castalia)",Camilo Jose Cela,2000,Castalia Publishing Company,0.0
95024,0449242668,Future in Question,Isaac   Et Al Asimov,1980,Fawcett Books,0.0
95025,0843947047,Loving Charity,Catherine Archibald,2000,Leisure Books,0.0
95026,0373201044,"Baby on the Way: The Vow / Wild Texas Rose / The Daddy Candidate (By Request, 3 Novels in One)",Dallas Schulze,1994,Harlequin,0.0
95027,0449223000,Full Stop (Loretta Lawson Mystery),Joan Smith,1997,Fawcett Books,0.0
95028,3570019438,Einer wie ich,Franz Beckenbauer,1975,C. Bertelsmann,1.0
95029,0440175763,Savage Grace,Natalie Robins,1992,Dell Publishing Company,1.8333333333333333
95030,0393022285,The Flamingo's Smile: Reflections in Natural History,Stephen Jay Gould,1985,W W Norton &amp; Co Inc,6.25
95031,0425134563,Games of the Hangman,Victor O'Reilly,1992,Berkley Publishing Group,0.0
95032,0722501994,Honey Cookery,Chris Stadtlaender,1967,HarperCollins Publishers,0.0
95033,0345283449,Robert Kennedy and His Times,Arthur Jr. Schlesinger,1979,Ballantine Books,0.0
95034,0446857769,"Disraeli, portrait of a romantic",David Butler,1980,Warner Books,0.0
95035,0451408098,"The Cadet Murder Case: A True Story of Teen Love and Deadly Revenge (Onyx True Crime, Je 809)",A. W. Gray,1997,Onyx Books,0.875
95036,0345291131,Duncton Wood,William Horwood,1981,Ballantine Books,0.0
95037,0451184750,Sacrifice,Mitchell Smith,1997,Onyx Books,0.0
95038,0451122879,Lantern in Her Hand,Bess Streeter Aldrich,1983,Signet Book,0.0
95039,067180877X,CITY OF DEAD,Herbert Lieberman,1977,Pocket,0.0
95040,0446603414,Starvation Heights : The True Story of an American Doctor and the Murder of a British Heiress (True Crime (Warner Books (Firm)).),Gregg Olsen,1997,Warner Books,0.0
95041,0440213657,A Love So Fierce,Joanna McGauran,1993,Dell Publishing Company,0.0
95042,0449244938,"TV, 2000",Isaac Asimov,1982,Fawcett Books,4.5
95043,0425156931,Silencing the Voices: One Woman's Triumph over Multiple Personality Disorder,Jean Darby Cline,1997,Berkley Publishing Group,4.666666666666667
95044,0553244205,Lily of the Mohawks,Jack Casey,1984,Bantam Books,0.0
95045,8408019899,"El mundo segÃºn el seÃ±or Casamajor: Un repaso lÃºcido a casi todo, de la mano de un gran personaje de nuestros dÃ­as (FÃ¡bula)",Javier SardÃ¡,1997,Planeta,5.0
95046,8432046361,AntologÃ­a de gazapos (ColecciÃ³n FÃ¡bula),Eduardo Ruiz de Velasco,1985,Planeta,2.5
95047,842078270X,Retrato de un detective enamorado (Espacio abierto),Emilio CalderÃ³n,1997,Anaya,5.0
95048,155773593X,Dead Line,D.F. Mills,1991,Diamond/Charter,0.0
95049,0425156036,The Whole Truth,Janice Kaplan,1997,Berkley Publishing Group,0.0
95050,1567407757,"Tuesdays With Morrie : An Old Man, a Young Man, and Life's Greatest Lesson (AUDIO CASSETTE)",Mitch Albom,1997,Nova Audio Books,3.8
95051,8401374618,El Rey: Conversaciones con D. Juan Carlos I de EspaÃ±a,JosÃ© Luis de Vilallonga,1993,Plaza &amp; JanÃ©s Editores,5.0
95052,8432043990,"Los \chungos\"", los fules (Documento)""",Enrique Rubio,1987,Planeta,5.0
95053,0786902604,Second Generation (Dragonlance Saga),Margaret Weis,1995,TSR,3.3333333333333335
95054,8482380184,Mesalina,Blanco Gonzalez,1995,Agata,5.0
95055,8432055875,Los hombres lloran solos (ColecciÃ³n Autores espaÃ±oles e hispanoamericanos),JosÃ© MarÃ­a Gironella,1986,Planeta,5.0
95056,8432042374,Disparates en la transiciÃ³n (ColecciÃ³n FÃ¡bula),Luis DÃ­ez JimÃ©nez,1984,Planeta,5.0
95057,8432047015,Formi: Aventuras de una hormiga (ColecciÃ³n FÃ¡bula),Luis DÃ­ez JimÃ©nez,1988,Planeta,5.0
95058,0060977035,Still Missing,Beth Gutcheon,1996,Perennial,3.8
95059,8440676980,AnticiclÃ³n de los Ozores,Antonio Ozores,1998,Ediciones B,5.0
95060,8420633380,Un noivo para mamÃ¡ y otros relatos,Gerald Durrell,1993,Alianza,5.0
95061,8420633372,El jardÃ­n de los dioses,Gerald Durrell,1982,Alianza,9.0
95062,8420633364,Bichos y demÃ¡s parientes,Gerald Durrell,1981,Alianza,9.0
95063,8420633356,Mi familia y otros animales,Gerald Durrell,1975,Alianza,4.75
95064,0671624849,BITCH,Judy Collins,1986,Pocket,0.0
95065,8432043753,Como Cazar a UN Naturalista Aficionado/How to Shoot an Amateur Naturalist,Gerald Durrell,1986,Planeta Pub Corp,9.0
95066,156076872X,"The Brazen Gambit (Dark Sun Chronicles of Athas, Book 1)",Lynn Abbey,1994,Wizards of the Coast,0.0
95067,843506011X,Los Navegantes (Narrativas Historicas Edhasa),Edward Rosset,2001,Edhasa,5.0
95068,8401013305,El Lobo Mongol,Homeric,2000,Downtown Book Center,6.5
95069,8401807239,"Al fin, la libertad: Un parado en el \Top-less\""""",CristÃ³bal Zaragoza,1986,Plaza &amp; JanÃ©s,5.0
95070,8440465114,La tahona de FroilÃ¡n,JosÃ© Antonio Pet Posse,1990,AM,5.0
95071,0380685280,Swap,Norma Klein,1984,Harper Mass Market Paperbacks (Mm),0.0
95072,8401351545,A Su Manera: Biografia No Autorizada De Frank Sinatra/His Way : The Unauthorized Biography of Frank Sinatra,Kitty Kelley,1987,Lectorum Pubns (J),5.0
95073,1560768878,The Enemy Within (Ravenloft),Christie Golden,1994,Wizards of the Coast,0.0
95074,8408024485,Ordenes ejecutivas,Tom Clancy,1998,"Editorial Planeta, S.A. (Barcelona)",7.333333333333333
95075,8408024493,Ordenes ejecutivas II,Tom Clancy,1998,"Editorial Planeta, S.A. (Barcelona)",5.0
95076,840801420X,DEUDA DE HONOR,Tom Clancy,0,Planeta Pub Corp,5.0
95077,8401495229,Juego De Patriotas,Tom Clancy,1999,Not Avail,5.0
95078,8401495210,Tormenta roja,Tom Clancy,1988,"Plaza &amp; Janes Editores, S.A.",2.5
95079,840802910X,Detective,Arthur Hailey,1999,"Editorial Planeta, S.A. (Barcelona)",5.0
95080,0671730126,FIRST TO FIGHT: VIEW OF THE US MARINES : FIRST TO FIGHT: VIEW OF THE US MARINES,Victor H. Krulak,1991,Pocket,0.0
95081,8401499569,El Valle De Los Leones/Lie Down With Lions,Ken Follett,1986,Lectorum Pubns Inc,5.0
95082,8401499593,Papel Moneda,Ken Follett,1999,"Plaza &amp; Janes Editores, S.A.",1.6666666666666667
95083,0380787148,Seal Team: : Rollback,Tim L. Bosiljevac,1999,Avon,4.0
95084,8401327636,El Fantasma De Manhattan,Frederick Forsyth,0,Plaza Y Janes Spanish,5.0
95085,8401324815,Aguilas Negras,Larry Collins,0,"Sage, Evelyn/editorial Molino",5.0
95086,1560763558,"Heart of Midnight (Ravenloft Books, No 4)",J. Robert King,1992,Wizards of the Coast,2.6666666666666665
95087,8466609016,Una Navidad Diferente,John Grisham,2002,Ediciones B,3.857142857142857
95088,8466602690,LA Granja,John Grisham,2001,Downtown Book Center,5.0
95089,8440681798,Causa justa,John Grisham,2000,Ediciones B,5.0
95090,844067581X,El Socio,John Grisham,1997,Ediciones B,5.0
95091,0441535038,The Mists of Doom,Robert E. Howard,1982,Ace Books,0.0
95092,0373076975,"Heart Of Devin Mackade (Heartbreakers, The Mackade Brothers) (Silhouette Intimate Moments No 697)",Nora Roberts,1996,Silhouette,2.888888888888889
95093,0373822014,Stolen Memories,Kelsey Roberts,2000,Harlequin Books,0.0
95094,0786010959,The Haunting,Ruby Jean Jensen,2000,Pinnacle Books,3.2
95095,0525947566,"Visits from the Afterlife: The Truth About Hauntings, Spirits, and Reunions With Lost Loved Ones",Sylvia Browne,2003,Dutton Books,3.25
95096,0877888566,When You Feel Like Screaming,Pat Holt,2000,Shaw Books,0.0
95097,0425164489,Empire's End (The X-Men),Diane Duane,1998,Boulevard Books,0.0
95098,0425164934,Prisoner X (Marvel Comics),Ann Nocenti,1998,Berkley Publishing Group,0.0
95099,0786907088,"Fistandantilus Reborn (Dragonlance Lost Legends, Vol. 2)",Douglas Niles,1997,Wizards of the Coast,0.0
95100,0786907878,"Vinas Solamnus (Dragonlance Lost Legends, Vol. 1)",J. Robert King,1997,Wizards of the Coast,5.2
95101,0786919035,Queen of the Demonweb Pits (Greyhawk Classics),Paul Kidd,2001,Wizards of the Coast,2.0
95102,0786914378,Bertrem's Guide to the Age of Mortals: Everyday Life in Krynn of the Fifth Age (A Dragonlance(r) Novel),Nancy Varian Berberick,2000,Wizards of the Coast,1.3333333333333333
95103,0786916354,Descent into the Depths of the Earth (Greyhawk),Paul Kidd,2000,Wizards of the Coast,5.666666666666667
95104,8449424070,Los Paseos De Agatha Christie (Paseos Literarios),Jean-Bernard Naudin,2002,Grupo Oceano,5.0
95105,8425333857,Alexandros. El Confin Del Mundo,Valerio Massimo Manfredi,1999,"Editorial Grijalbo, S.A. de C.V.",2.5
95106,0345379039,Wolf in Shadow (Stones of Power),David Gemmell,1997,Del Rey Books,0.0
95107,8440641958,El Comite de La Muerte,Noah Gordon,1996,Ediciones B,5.0
95108,0451200748,Intimates Through Time: Edgar Cayce's Mysteries of Reincarnation,Jess Stearn,2000,Signet Book,0.0
95109,8425334152,La Extraordinaria Historia de La Vida,Alberto Angela,2000,Grijalbo,8.0
95110,078690710X,"Cormyr (Forgotten Realms:  The Cormyr Saga, Book 1)",Ed Greenwood,1998,Wizards of the Coast,0.0
95111,1560768304,"The Dragons of Krynn (Dragonlance Dragons, Vol. 1)",Margaret Weis,1994,Wizards of the Coast,2.7142857142857144
95112,0786918144,"Downfall (Dragonlance:  The Dhamon Saga, Book 1)",Jean Rabe,2001,Wizards of the Coast,0.0
95113,0761504427,Crafting for Dollars: Turn Your Hobby into Serious Cash,Sylvia Landman,1996,Prima Lifestyles,0.0
95114,0760700133,This side of paradise (Barnes &amp; Noble classics),F. Scott Fitzgerald,1996,Barnes &amp; Noble Books,2.6666666666666665
95115,8478808353,Todo Por la Empresa,Jose M. Hermida,2000,Temas'de Hoy,2.5
95116,1561706671,My Life With Sylvia Browne: A Son Reflects on Life With His Psychic Mother,Chris Dufresne,2000,Hay House,9.0
95117,1560449667,It Happened in North Carolina,Scotti Kent,2000,Two Dot Books,0.0
95118,8423309754,El Disputado Voto del Senor Cayo (ColecciÃ³n Ancora y delfÃ­n ; v. 533),Miguel Delibes,1996,Destino Ediciones,3.75
95119,8474861004,El Guardamarina Bolitho,Alexander Kent,1998,Noray,5.0
95120,081287014X,Complete Home Medical Guide for Cats,Stephen Schneck,1975,Scarborough House,0.0
95121,0451130405,Stud,Jackie Collins,1971,Signet Book,0.0
95122,8474324122,Juegos Para Devanarse Los Sesos / Games That Rack One's Brain,E. R. (Eric Revell) Emmet,1992,Gedisa Editorial,5.0
95123,8474861306,Nubes de Tormenta,Alexander Kent,2003,Noray,5.0
95124,843205593X,Tres chicas y un forastero (ColecciÃ³n Autores espaÃ±oles e hispanoamericanos),Emilio Romero,1987,Planeta,5.0
95125,8432053236,"Icaria, Icaria: Novela (Autores espaÃ±oles e hispanoamericanos)",Xavier Benguerel,1974,Editorial Planeta,5.0
95126,8401499712,Un Espia Perfecto,John Le Carre,2000,Plaza &amp; Janes Editores,5.0
95127,8474861020,Corsarios Americanos,Alexander Kent,2004,Noray,5.0
95128,0380769387,How to Have Multiple Orgasms,Janalee Beck,1993,Avon,0.0
95129,044661033X,Penthouse: Naughty by Nature: Female Readers' Sexy Letters to Penthouse,Penthouse Magazine,2002,Warner Books,6.0
95130,8474861063,Al Mando de Una Corbeta,Alexander Kent,2002,Noray,5.0
95131,847486108X,"Fragata Maldita, La",Alexander Kent,2002,Noray,5.0
95132,8474861098,Mision En Ultramar,Alexander Kent,2002,Noray,5.0
95133,8474861136,Aires de Motin,Alexander Kent,2001,Noray,7.0
95134,0345452488,"Time's Eye (A Time Odyssey, Book 1)",ARTHUR C. CLARKE,2004,Del Rey,3.875
95135,0743443098,The Laughter of Dark Gods (Warhammer Novels (Paperback)),David Pringle,2002,Black Library,0.0
95136,0671784218,Hammers of Ulric,Dan Abnett,2000,Games Workshop,0.0
95137,0786906472,Realms of the Arcane (Forgotten Realms),Brian M. Thomsen,1997,Wizards of the Coast,0.0
95138,8483102404,El fondo de la botella,Georges Simenon,2003,Tusquets USA Pub,5.0
95139,8474861152,Libertad de Accion,Alexander Kent,2001,Noray,5.0
95140,0743411668,Lords of Valour (Warhammer Novels (Paperback)),Marc Gascoigne,2001,Black Library,0.0
95141,8474861284,Buque Insignia,Alexander Kent,2004,Noray,5.0
95142,8408016059,Todos al paro! (ColecciÃ³n FÃ¡bula),Fernando VizcaÃ­no Casas,1995,Planeta,2.5
95143,8408012312,--y los 40 ladrones (ColecciÃ³n FÃ¡bula),Fernando VizcaÃ­no Casas,1994,Planeta,5.0
95144,074325998X,"For Us, The Living : A Comedy of Customs",Robert A. Heinlein,2004,Scribner,2.2
95145,8432047082,Ultimas voluntades (ColecciÃ³n FÃ¡bula),Alfredo Amestoy,1989,Planeta,5.0
95146,8401323096,"Compromiso, El",Howard Fast,1998,"Plaza &amp; Janes Editores, S.A.",2.5
95147,8478444424,El Supergordo,Peter Carey,1999,Siruela,5.0
95148,0671784056,Realm of Chaos,Marc Gascoigne,2000,Games Workshop,0.0
95149,0786907851,"The Doom Brigade (Dragonlance Kang's Regiment, Vol. 1)",Margaret Weis,1998,Wizards of the Coast,2.0
95150,8401377706,Anecdotas De LA Medicina,Pedro Manuel Ramos Calvo,2001,Downtown Book Center,6.0
95151,1565112199,Your Oasis on Flame Lake,Lorna Landvik,1997,Highbridge Audio,0.0
95152,0375505741,Blood of Victory : A Novel,ALAN FURST,2002,Random House,3.5
95153,0399147969,The Burying Field,Kenneth Abel,2002,Putnam Publishing Group,6.4
95154,0786867914,"Red Sky in Mourning: A True Story of Love, Loss, and Survival at Sea",Tami Oldham Ashcraft,2002,Hyperion Press,1.0
95155,0924486732,Survive the Savage Sea,Dougal Robertson,1994,Sheridan House,3.0
95156,1878448056,The Long Home,William Gay,2000,MacAdam/Cage Publishing,4.0
95157,0804119961,Looking for Lacey,Linda Francis Lee,2003,Ivy Books,1.2
95158,0425172619,Evan Help Us (Constable Evan Evans Mysteries (Paperback)),Rhys Bowen,1999,Berkley Publishing Group,1.6666666666666667
95159,8433920383,Lolita,Vladimir Vladimirovich Nabokov,1991,Anagrama,1.6666666666666667
95160,8433920103,Noticia Bomba!,Evelyn Waugh,1995,Anagrama,2.5
95161,843392091X,Baile En Familia,David Leavitt,1994,Anagrama,5.0
95162,8433914588,Los Dominios del Lobo,Javier Marias,1997,Anagrama,5.0
95163,8433920413,El Crack-Up,Francis Scott Fitzgerald,1998,Anagrama,5.0
95164,8433920405,El Ultimo Magnate,Francis Scott Fitzgerald,1995,Anagrama,5.0
95165,8433920723,DOS Dias de Setiembre,Caballo Bonald,1993,Anagrama,5.0
95166,8433920588,La Vida Instrucciones de USO,Georges Perec,1995,Anagrama,4.75
95167,843392060X,Palido Fuego,Vladimir Nabokov,1999,Anagrama,4.0
95168,1852235586,Orienteering: The Skills of the Game,Carol McNeill,1991,Trafalgar Square,7.0
95169,8433920111,Cronicas de Motel,Sam Shepard,1995,Anagrama,5.0
95170,0373256140,"Kiss In The Dark (Harlequin Temptation, No 514)",Steve White,1994,Harlequin,8.0
95171,8433920294,El Secuestro de Miss Blandish,James H. Chase,1998,Anagrama,2.5
95172,843392009X,DOS Damas Muy Serias,Jane Bowles,1995,Anagrama,5.0
95173,8433920065,Reunion Tumultuosa,Tom Sharpe,1993,Anagrama,5.5
95174,843392012X,Desde El Jardin,Jerzy Kosinski,1998,Anagrama,5.0
95175,843392057X,Catedral,Raymond Carver,1995,Anagrama,2.4444444444444446
95176,0898797268,Romance Writer's Sourcebook: Where to Sell Your Manuscripts (1st ed. Issn 1081-6739),David H. Borcherding,1996,F &amp; W Pubns,5.0
95177,8433920049,El Talento De Mr Ripley,Patricia Highsmith,2002,Anagrama,5.0
95178,0821770179,My Fair Quiggley (Zebra Book.),Judith A. Lansdowne,2001,Zebra Books,1.625
95179,8433920073,LA Mascara De Ripley,Patricia Highsmith,2002,Anagrama,5.0
95180,082175145X,Gwen's Christmas Ghost,Lynn Kerstan,1995,Zebra Books,8.0
95181,8433920375,Antologia del Humor Negro,Andre Breton,1994,Anagrama,5.0
95182,8433920391,Mi Tio Oswald,Roald Dahl,1997,Anagrama,4.0
95183,8433920162,Una Dama En Apuros,Tom Sharpe,1998,Anagrama,5.5
95184,0373242204,"Millionaire Bachelor (Silhouette Special Edition, 1220)",Susan Mallery,1998,Silhouette,5.0
95185,0373440146,"Irresistible (Love and Laughter, No 14)",Stephanie Bond,1997,Harlequin,8.5
95186,8433923005,Vicios Ancestrales,Tom Sharpe,1995,Anagrama,5.0
95187,8433923455,La Gran Pesquisa,Tom Sharpe,1996,Anagrama,5.0
95188,0451522338,Chronicles of Avonlea,Lucy Maude Montgomery,1995,Signet Classics,1.6666666666666667
95189,8433912712,"LA Vida, El Universo Y Todo Lo Demas/Life, the Universe and Everything",Douglas Adams,1985,Lectorum Pubns (J),8.0
95190,8433923129,Un negro con un saxo,Ferran Torrent,1988,Anagrama,5.0
95191,8433923285,"Animo, Wilt!",Tom Sharpe,1991,Anagrama,5.0
95192,0373483678,The Taming of Billy Jones,Christine Rimmer,1998,Silhouette,0.0
95193,8433923501,Informe Sobre La Tierra: Fundamentalmente in,Douglas Adams,1999,Anagrama,7.0
95194,0848715527,Jenny Craig's Little Survival Guide: 201 Tips for Managing Your Weight and Your Life,Jenny Craig,1996,Oxmoor House,0.0
95195,8433923439,Iras Celestiales,Douglas Adams,1993,Anagrama,7.0
95196,0446403423,"Baby, Would I Lie?",Donald E. Westlake,1995,Warner Books,0.0
95197,0806904739,The LIttle Giant book of Whodunits,Hy Conrad,1998,Sterling Publishing,4.5
95198,843392365X,Becas Flacas,Tom Sharpe,1997,Anagrama,5.0
95199,0758201222,The Stand-In,Kate Clemens,2003,Kensington Publishing Corporation,2.75
95200,8433912364,El Gran Cambiazo,Roald Dahl,1994,Anagrama,5.0
95201,0553214020,The Scarlet Pimpernel (Bantam Classic),Baroness Emmuska Orczy,1992,Bantam Books,3.0
95202,8401464625,"Fiebre Primaveral (Fiction, Poetry and Drama)",Wodehouse,0,Plaza &amp; Janes Editor,5.0
95203,0373059108,"Truth Or Dare (Silhouette Desire, No 910)",Caroline Cross,1995,Silhouette,0.0
95204,0553289594,Among the Shadows: Tales from the Darker Side,L.M. Montgomery,1991,Starfire,3.75
95205,8433914510,La Suerte de Los Bodkin,P. G. Wodehouse,1996,Anagrama,5.0
95206,843391443X,Luna de Verano,P. G. Wodehouse,1998,Anagrama,5.0
95207,0425165728,The Starlite Drive-In,Marjorie Reynolds,1998,Berkley Publishing Group,2.5714285714285716
95208,8433914421,Locuras de Hollywood,P. G. Wodehouse,1998,Anagrama,5.0
95209,8433920693,"Guapo, Rico y Distinguido",P. G. Wodehouse,1993,Anagrama,5.0
95210,843392043X,"Gressiones, Eyaculaciones, Exhibiciones",Charles Bukowski,0,"Anagrama, Editorial S.A.",5.5
95211,8433920251,Ola de Crimenes En El Castillo de Bland,P. G. Wodehouse,1993,Anagrama,5.0
95212,8433920219,"de Acuerdo, Jeeves",P. G. Wodehouse,1998,Anagrama,5.0
95213,8433920200,El Inimitable Jeeves,P. G. Wodehouse,1998,Anagrama,5.0
95214,8478760733,El cuarto corazÃ³n (Humorismos Versal),Alicia GimÃ©nez Bartlett,1991,Versal,5.0
95215,8478887121,LA Nochevieja De Montalbano (Narrativa),Andrea Camilleri,2001,Salamandra,10.0
95216,8478886680,LA Excursion a Tindari (Narrativa),Andrea Camilleri,2001,Oceano De Mexico,10.0
95217,8423334473,LA Desa Paricion De Pato,Andrea Camilleri,2002,Planeta Pub Corp,10.0
95218,0689850859,Terry and the Pirates,Julian F. Thompson,2002,Simon Pulse,5.0
95219,0465043089,The Hidden Hitler,Lothar Machtan,2001,Basic Books,3.5
95220,0373619316,"Command Force (Stony Man #47) (Stony Man, No 47)",Don Pendleton,2000,Gold Eagle,4.0
95221,8427201648,Srta Marple Y Trece Problemas: Srta Marple Y Trece Problemas,Christie,0,Editorial Molino,8.0
95222,8427201362,Pleamares de la Vida,Agatha Christie,1986,Editorial Molino,8.0
95223,8427202970,Telon,Agatha Christie,1984,Aims Intl Books,7.666666666666667
95224,8427202733,El Misterio de Listerdale,Agatha Christie,1984,Editorial Molino,8.0
95225,842720163X,Ocho Casos De Poirot: Ocho Casos De Poirot,Christie,0,Editorial Molino,7.333333333333333
95226,8427201621,Los Trabajos De Hercules: Los Trabajos De Hercules,Christie,0,Editorial Molino,8.0
95227,8427207336,El Caso Del Patito Que Se Ahogaba/the Case of the Drowning Duck,Erle Stanley Gardner,1981,Lectorum Pubns (Adult),5.0
95228,8427207212,El Caso Del Sonambulo/the Case of the Sleepwakler's Niece,Erle Stanley Gardner,1981,Lectorum Pubns (Adult),5.0
95229,8427207484,El caso del testigo airado,Erle Stanley Gardner,1970,Lectorum Pubns (Adult),5.0
95230,0920897886,"Writing the Circle: Native Women of Western Canada, an Anthology",Jeanne Perreault,1990,Lpg Distribution,10.0
95231,0801319536,Classical Mythology,Mark P. O. Morford,1998,John Wiley &amp; Sons,7.0
95232,0099279444,The BRIDESMAID/TO FEAR A PAINTED,RUTH RENDELL,1998,Random House UK Ltd (A Division of Random House Group),0.0
95233,8420466557,Divorcio a la francesa,Diane Johnson,2003,Santillana Pub Co,5.0
95234,8408040677,Los Borgia (Planeta Internacional),Mario Puzo,2001,Planeta Publishing Corporation,4.5
95235,8483105438,Relatos (Marginales),Samuel Beckett,2002,Tusquets,5.0
95236,8408034618,Empate a muerte,Brad Meltzer,2000,Downtown Book Center (Sd),5.0
95237,8401376734,Memorias No Autorizadas,Jose Luis de Vilallonga,2003,"Plaza &amp; Janes Editores, S.A.",5.0
95238,8475094600,Como No Ser Una Madre Perfecta,Libby Purves,1987,"Paidc\s Iberica""",6.0
95239,0345350561,Rendevous With Rama,Arthur C. Clarke,1999,Del Rey Books,4.25
95240,8433000225,Biblia de Jerusalen,Jose Angel Ubieta,1977,Desclee de Brouwer,5.0
95241,8440694407,Glamourama,Bret Easton Ellis,2000,Ediciones B,6.0
95242,847702197X,"SatÃ¡n en Hollywood: Una historia mÃ¡gica del cine (Serie \Autores espaÃ±oles\"")""",JesÃºs Palacios,1997,Valdemar,5.0
95243,1862543135,Sentence: Siberia,Ann Lehtmets,1998,"Wakefield Press Pty, Limited (AUS)",9.0
95244,0747266336,Enjoy!,Chris Sinclair-stevenson,2001,Headline,7.0
95245,8478807179,Cuando Ã©ramos los mejores,J. J Armas Marcelo,1997,Temas de Hoy,6.0
95246,8403599072,Athletic 100: Conversaciones en La Catedral,Manuel Leguineche,1998,Aguilar,5.0
95247,8403597223,Las cosas de Robin (Visto y leÃ­do),Michael Robinson,1996,Aguilar,6.5
